{
  "schema_version": "1.0",
  "id": "TASK-1101",
  "title": "Project skeleton and dependency setup",
  "description": "Stand up the Python project: virtualenv, requirements.txt (faster-whisper with CUDA, audio + UI deps), app entry point, and a smoke test that imports the package and asserts the entry point is callable.",
  "depends_on": [],
  "files_touched_estimate": [
    "projects/translator-app/src/translator_app/__init__.py",
    "projects/translator-app/src/translator_app/__main__.py",
    "projects/translator-app/requirements.txt",
    "projects/translator-app/tests/test_smoke.py"
  ],
  "acceptance_criteria": [
    "Fresh environment installs from requirements.txt",
    "Entry point launches without error",
    "Smoke test passes"
  ]
}
