{
  "schema_version": "1.0",
  "id": "TASK-203",
  "title": "Update HOWTO.md for human operators",
  "description": "Update HOWTO.md so human operators know /plan now runs a build-type interview: describe the two-phase flow, what it produces, and the confirm-back gates, pointing at .agent/plan-interview.md for the full script.",
  "depends_on": [
    "TASK-201"
  ],
  "files_touched_estimate": [
    "HOWTO.md"
  ],
  "acceptance_criteria": [
    "HOWTO.md describes the interview behavior for human operators and points at the interview guide."
  ]
}
